{
  "schema_version": 1,
  "scope": "representative_unit",
  "participant": {
    "id": "g4-independent-ai-learner",
    "type": "independent-ai",
    "roles": [
      "isolated learner"
    ]
  },
  "isolated_context_id": "g4-cold-ai-context-20261018-a",
  "allowed_inputs": [
    {
      "kind": "learner-page",
      "path": "course/unit-3.html",
      "sha256": "a1ec3e16626e35673b793ef2fe03d7e5146e5a66ce659e7cb300f9b6f85413c1"
    },
    {
      "kind": "learner-asset",
      "path": "course/assets/campaign-data.csv",
      "sha256": "6ce1da5dc15dc131b8fae9422c88356397047343ee37461d64c4b27594efb103"
    },
    {
      "kind": "learner-asset",
      "path": "course/assets/brief-template.md",
      "sha256": "a0c35ba9df076f6352e037ba4de599370b6ecc622ead2969ff99c78e4c065d0c"
    },
    {
      "kind": "learner-asset",
      "path": "course/assets/rubric.md",
      "sha256": "e95059475235c93b9556f8e298d2b67d5042b7d321d13f9ffdea8022d23c8370"
    }
  ],
  "forbidden_inputs_accessed": [],
  "entry": {
    "started_at": "2026-10-18T14:52:47+08:00",
    "page": "course/unit-3.html",
    "goal_understood": true,
    "materials_found": true
  },
  "actions": [
    {
      "sequence": 1,
      "action": "閱讀單元三頁面並辨識交付目標、達標門檻與資料界線要求。",
      "observable_result": "確認成品需包含三個活動的五項指標、雙重門檻判讀、不能確定的事項及可驗證下一步。",
      "at": "2026-10-18T14:52:47+08:00"
    },
    {
      "sequence": 2,
      "action": "讀取活動 CSV，依頁面與 rubric 指定公式逐列計算。",
      "observable_result": "得到 Brand Search 的 8.00%、10.00%、NT$30、NT$300、6.67；Prospecting Social 的 1.80%、5.00%、NT$50、NT$1,000、2.00；Retargeting Display 的 2.50%、10.00%、NT$40、NT$400、6.25。",
      "at": "2026-10-18T14:52:47+08:00"
    },
    {
      "sequence": 3,
      "action": "閱讀摘要模板與驗收規則，安排數據摘要、判讀、建議及自評段落。",
      "observable_result": "確認 Prospecting Social 未達雙重門檻，另兩個活動達標；建議必須包含行動與後續觀察指標。",
      "at": "2026-10-18T14:52:47+08:00"
    },
    {
      "sequence": 4,
      "action": "建立缺少的指定輸出資料夾。",
      "observable_result": "trials/g4-output 可寫入，未變更其他檔案。",
      "at": "2026-10-18T14:52:52+08:00"
    },
    {
      "sequence": 5,
      "action": "撰寫指標表、達標判讀、資料界線與下一步。",
      "observable_result": "完成 trials/g4-output/metrics-table.md；表格含三個活動與五項指標，並分開寫資料顯示與仍不能確定。",
      "at": "2026-10-18T14:53:07+08:00"
    },
    {
      "sequence": 6,
      "action": "依 rubric 逐項自評，並由 CSV 再次重算五項指標。",
      "observable_result": "重算值與成品完全一致，rubric 5 項皆通過，沒有未恢復阻礙。",
      "at": "2026-10-18T14:53:07+08:00"
    },
    {
      "sequence": 7,
      "action": "記錄本次隔離試走的輸入、操作、恢復與結果。",
      "observable_result": "產生 g4-representative-unit.json；未存取白名單外的專案內容。",
      "at": "2026-10-18T14:53:19+08:00"
    }
  ],
  "hints": [
    {
      "source": "learner-page",
      "detail": "使用單元頁提供的 CPA 與 ROAS 雙重門檻、Prospecting Social 完整判讀示範，以及將因果敘述改為可驗證假設的提醒。"
    },
    {
      "source": "learner-asset",
      "detail": "使用 brief-template.md 的數據摘要、判讀與建議結構。"
    },
    {
      "source": "learner-asset",
      "detail": "使用 rubric.md 的五項完成條件逐項自評。"
    }
  ],
  "blocks": [
    {
      "code": "OUTPUT_DIRECTORY_ABSENT",
      "detail": "指定的 trials/g4-output 資料夾起初不存在，無法直接建立交付檔案。",
      "recovered": true
    }
  ],
  "recovery": [
    {
      "block_code": "OUTPUT_DIRECTORY_ABSENT",
      "action": "只建立指定的 trials/g4-output 資料夾後繼續寫入。",
      "result": "兩個指定輸出檔案可建立，未影響學習任務內容。"
    }
  ],
  "artifact": {
    "path": "trials/g4-output/metrics-table.md",
    "sha256": "de897f6d13cb036e4cabc00715221bee52c1bd12f87fd08401dfeb3206cfe21f",
    "complete": true,
    "verifiable": true,
    "acceptance_result": "PASS"
  },
  "result": {
    "status": "PASS",
    "completed_at": "2026-10-18T14:53:19+08:00",
    "notes": "單元目標可由學員頁與三個必要素材獨立完成；所有公式重算一致，無未恢復阻礙。styles.css 未讀取，因完成資料任務不需要視覺樣式資訊。"
  }
}
